Year,Specie,Area,ManagementAdvice,Biology,fishery,Assessment,Outputs
2019,Razor Clams,North Irish Sea,"<p>The Irish Sea razor clam (<i>Ensis siliqua</i>) are assessed by annual survey. <b>This years estimated total biomass was 6,936 tonnes, 93% of which was above the 130 mm MLS</b>. In the North Irish Sea management is limited to 130mm shell length minimum landing size (MLS), fishing can only occur within areas classified (microbiologically) production areas, there is no fishing on Sunday and the fishery is closed by voluntary agreement in June. All vessels report GPS position at 10 minutes or higher frequency.</p>

<p>Many razor clam fisheries or potential fisheries occur within or close to Natura 2000 sites. The conservation objectives for species and habitats in these areas are integrated into razor clam fishery management advice.Ecosystem effects of fishing may include changes to the deep burrowing bivalve community in shallow sediments and potentially reduced prey availability to diving seaducks (Common Scoter) although this species feeds primarily on smaller bivalves at the sediment surface.</p>","<p>Razor clams (<i>Ensis siliqua</i>/<i>Ensis magnus</i>) are a species of deep burrowing bivalve inhabiting mixed sediments in shallow coastal water. Exact sediment requirements (grain size) varies by species. They are a component species of a deep burrowing megafauna community of species which also includes many other bivalve species such as otter shell (<i>Lutraria</i> sp), spiny cockle (<i>Acanthocardia</i> sp), blood razors (<i>Pharus legumen</i>) and Icelandic clam (<i>Arctica islandica</i>). They have a free swimming pelagic larval phase which aids dispersal although juvenile and adult clams may also swim and move to new locations. Growth is rapid in the first 3 years but slows with age; Clams at commercial size may be over 5 years. Spawning may occur from May to July. Maturation occurs below the minimum landing size of 130mm.</p>

","<p>Razor clams are fished mainly in shallow waters of the western Irish Sea from Dundalk Bay south to Malahide and also along the east Wexford coast. Fishing involves use of hydraulic non-suction dredges which fluidises sediment to a depth of 25cm in front of the dredge and dislodges clams that are then caught in the dredge. Fishing depth is limited by the functioning of the hydraulics and capacity to generate high water pressure at the dredge head. In the Irish Sea fishing occurs from the low water mark seaward to about 15m. Clams are landed and sold live mainly to the Asian market. There are about 70 vessels in the fishery. The fishery has expanded geographically and in total effort in recent years and is now a very important inshore fishery in the Irish Sea.</p>

<p>Smaller fisheries for razor clams occur on the west coast around Clifden Bay, Inisbofin, Killary, Iniskeas, Blacksod Bay, Broadhaven Bay and other areas. These have been fished under management plans in recent years but most are currently closed.</p>
","<p>A total of 808 tows were undertaken using five different vessels, with hydraulic dredges ranging from 0.92-1.2m width. GPS data for each tow line was recorded on a Trimble GPS survey unit. Following a standardized protocol applied to the 2017-2020 survey data, GPS tracks were inspected to identify potentially erroneous tracks due to lack of GPS track connectivity, and a Gaussian Kernel regression technique was applied as a way to smooth unrealistic spikes resulting from the position accuracy (1-3m) of the Trimble units. Based on the final track length and the gear width, swept area for each tow was estimated, resulting in a total sampling effort of 28,354 m<sup>2</sup>. </p>

<p>Biomass at each station was estimated as the product of density (number of individuals caught per meter squared towed area) and mean individual weight calculated from the size distribution at the station and a weight-length relationship. Biomass was then interpolated over a 200 m x 200 m grid using ordinary kriging on log(biomass). Total biomass was then estimated as the sum of mean estimated biomass, using a geostatistical (kriging) model, raised to the surface area of the cells. Ninety-five percent confidence intervals were estimated based upon 500 random realisations of the modelled biomass using conditional Gaussian simulations. This method preserves the spatial structure in the biomass, as described by variograms, which modelled the spatial autocorrelation and spatial structure in the survey data.</p> ","<p>Biomass of all size classes of razors uncorrected for dredge efficiency varied from 0.0044-0.66 kgs/m<sup>2</sup>. Distribution of high density patches is similar across size ranges. The estimated biomass was 6,936 tonnes, with 93% of the total biomass above the 130 mm MLS.</p>

<p>The size distribution of razor clams in the North Irish Sea in 2019 shows a slight rightward move due to growth in the ~140mm cohort observed in the 2018 survey. No sign of recruitment was observed. </p>
"
2019,Razor Clams,South Irish Sea,"<p>The Irish Sea razor clams (<i>Ensis siliqua</i>) are assessed by annual survey. <b>This years estimated biomass was 6,268 tonnes, 84% of which was above the 130 mm MLS</b>. In the South Irish Sea management measures include an MLS of 130 mm, fishing hours from 07:00 to 19:00, 2 tonne quota per vessel per week, 1 dredge per vessel not to exceed 122 cm width with bar spacing not less than 10 mm, prior notice of intention to fish and advance notice of landing, mandatory submission of gatherers docket information on landings, date and location of fishing and a defined fishing area to minimise overlap with Natura 2000 sites. All vessels report GPS position at 10 minutes or higher frequency.</p>

<p>Many razor clam fisheries or potential fisheries occur within or close to Natura 2000 sites. The conservation objectives for species and habitats in these areas are integrated into razor clam fishery management advice. Ecosystem effects of fishing may include changes to the deep burrowing bivalve community in shallow sediments and potentially reduced prey availability to diving seaducks (Common Scoter) although this species feeds primarily on smaller bivalves at the sediment surface.</p>","<p>Razor clams (<i>Ensis siliqua</i>/<i>Ensis magnus</i>) are a species of deep burrowing bivalve inhabiting mixed sediments in shallow coastal water. Exact sediment requirements (grain size) varies by species. They are a component species of a deep burrowing megafauna community of species which also includes many other bivalve species such as otter shell (<i>Lutraria</i> sp), spiny cockle (<i>Acanthocardia</i> sp), blood razors (<i>Pharus legumen</i>) and Icelandic clam (<i>Arctica islandica</i>). They have a free swimming pelagic larval phase which aids dispersal although juvenile and adult clams may also swim and move to new locations. Growth is rapid in the first 3 years but slows with age; clams at commercial size may be over 5 years. Spawning may occur from May to July. Maturation occurs below the minimum landing size of 130mm.</p>
","<p>Razor clams are fished mainly in shallow waters of the western Irish Sea from Dundalk Bay south to Malahide and also along the east Wexford coast. Fishing involves use of hydraulic non-suction dredges which fluidises sediment to a depth of 25cm in front of the dredge and dislodges clams that are then caught in the dredge. Fishing depth is limited by the functioning of the hydraulics and capacity to generate high water pressure at the dredge head. In the Irish Sea fishing occurs from the low water mark seaward to about 15m. Clams are landed and sold live mainly to the Asian market. There are about 70 vessels in the fishery. The fishery has expanded geographically and in total effort in recent years and is now a very important inshore fishery in the Irish Sea.</p>

<p>Smaller fisheries for razor clams occur on the west coast around Clifden Bay, Inisbofin, Killary, Iniskeas, Blacksod Bay, Broadhaven Bay and other areas. These have been fished under management plans in recent years but most are currently closed.</p>
","<p>The razor bed of Rosslare was surveyed in August 2019.  A total of 50 tows were undertaken, with a single toothless dredge of width 1.06m. GPS data for each tow line was recorded on a Trimble GPS survey unit and swept area for each tow estimated. The survey encompassed a combined area of 11.2 km<sup>2</sup> and a total sampling effort of 1,575m<sup>2</sup>.</p>

<p>Biomass at each station was estimated as the product of density (number of individuals caught per meter squared towed area) and mean individual weight calculated from the size distribution at the station and a weight-length relationship. Biomass was then interpolated over a grid using ordinary kriging on log(biomass). Total biomass was then estimated as the sum of mean estimated biomass, using a geostatistical (kriging) model, raised to the surface area of the cells. Ninety-five percent confidence intervals were estimated based upon random realisations of the modelled biomass using conditional Gaussian simulations. This method preserves the spatial structure in the biomass, as described by variograms, which modelled the spatial autocorrelation and spatial structure in the survey data.</p>","<p>Biomass of all size classes of razors uncorrected for dredge efficiency varied from 0.013-1.5 kgs/m<sup>2</sup>. Higher densities of razor clams <130 mm MLS are found at the centre of the bed, whereas razors >150 mm are more abundant towards the northern side of the surveyed area . </p>

<p>The estimated biomass was 6,268 tonnes, almost all of which (84%) was above the 130 mm MLS.</p>

<p>The size distribution of razor clams in Rosslare in 2019 shows a rightward move indicative of growth with a main mode at ~140mm and a overall decrease in densities due to mortality compared to the 2018 survey. No recruitment signal is indicated as densities of small razor clams remains low.</p>
"
2019,Oyster,Fenit,"<p>Native oyster (<i>Ostrea edulis</i>) stocks are in most cases managed locally by Oyster Co-operatives who have delegated authority to manage oysters in specific areas. The fishery is managed primarily by a minimum landing size (MLS) of 76-78 mm. The minimum size is generally reached at age 4-5. Oysters generally mature well below the MLS. Local quotas or TACs may be in force. The number of dredge permits issued annually to each co-operative by Inland Fisheries Ireland is limited.</p>

<p>Stocks are assessed by annual surveys which provide biomass estimates, although dredge efficiency (catchability) is uncertain. <b>Assuming a 35% dredge efficency, this years total biomass estimate was 879 tonnes, 29% of which was above the 76mm MLS</b>. Stock biomass is generally depleted in all areas, except inner Tralee Bay, and management measures to restore recruitment and re-build spawning stocks are necessary. Various threats to native oyster stocks exist including naturalisation of Pacific oyster (<i>Magallana gigas</i>), Bonamia infection, poor water quality, unfavourable habitat conditions for settlement and low spawning stocks. Pacific oyster has naturalised in Lough Swilly in recent years and supports a commercial fishery.</p>

<p>Generally, although seasonal quotas and minimum size regulations are in place for some fisheries, management plans or recovery plans should be developed in order to restore productivity of stocks. A range of actions should be considered including areas closed to fishing where spawning stock could be re-built, removal of Pacific oysters, maintenance or recovery of habitat for settlement, development of harvest control rules and improving operational management locally. Draft management plans are in place for a number of co-operatives as of 2023.</p>

<p>Oyster beds are also constituents of habitats designated under the Habitats Directive in many areas. Specific conservation objectives have been defined for these habitats in some sites. Oyster management plans also need to consider the conservation objectives for oyster habitat or for habitat in which oyster is a characterising species.</p>
","<p>Native oysters (<i>Ostrea edulis</i>) are bivalve molluscs. Oysters are a protandric hermaphrodite species, meaning they mature first as a male and then have the ability to change between male and female later in life. Males release sperm into the water column and females brood the fertilised eggs in their gills. One female can produce 500,000 to 1 million larvae in a spawning season after brooding the eggs for 8-10days in their gills.</p>

<p>Native oysters are filter feeders, consuming plankton and detritus from the water column. They are predated on by various species, including humans, crabs, whelks and starfish. They are often referred to as &#39;ecosystem engineers&#39; because of the important ecosystem service they provide, including creating reef habitats which attracts other species and can protect against coastal erosion and improve water quality through filter feeding.</p>

<p>The distribution of native oysters extends from the Norwegian Sea in the North, the Southern North Sea, around Ireland and Britain and south as far as the Mediterranean Sea, naturally inhabiting lower intertidal and shallow subtital habitats. In oyster sites on the west coast of Ireland, spawning occurs frequently if not annually and larval settlement is dependent on seawater temperatures in mid summer. Growth is seasonal, with a significant increase during the summer months and slow or even negative growth (due to shell edge erosion) in winter.</p>

","<p>Oysters are fished with simple light weight dredges fitted with a blade or toothed bar depending on area of fishing and ground type. The vessels involved can vary from 5-6 m open punts to half deckers between 8-14 m. The fishing season may be written into the fishery orders eg Galway Bay is open to fishing in December only. In other cases fishing generally occurs from September to January. Fishing may not occur every year and in recent years there has been no fishing in many areas because of low stock levels. Oysters are usually sold centrally through the co-operatives.</p>

<p>Native oyster stocks were extirpated from large areas of the north Sea and Irish Sea by fishing in the 19<sup>th</sup> century. Overfishing in coastal areas has also led to decline in coastal beds. Since the 1980s this decline was exacerbated following the accidental introduction of the haplosporidian parasite <i>Bonamia ostrea</i>.</p>
","<p>An annual survey was carried out on October 1st and 2nd on the Fenit Oyster Bed. A total of 57 tows were undertaken, with a single toothless dredge of width 1.20m. GPS data for each tow line was recorded on a Trimble GPS survey unit and swept area for each tow estimated. The survey encompassed an area of 3.7 km<sup>2</sup> east of Fenit pier.</p> ","<p>Similar to 2018 the 2019 size distribution of oysters caught during the survey shows a strong mode at about 70mm and a smaller mode at 20-40mm.  The density of oysters at the higher mode of 70mm decreased in October 2019 from September 2018.  Inter-annual variability in the biomass estimates could be due to a possible difference in dredging efficiency between years and must therefore be interpreted with caution. Total biomass of oysters, assuming a dredge efficiency of 35%, was 879 tonnes. The equivalent biomass of oysters 76m or over was 257 tonnes.</p>"
2018,Razor Clams,North Irish Sea,"<p>The Irish Sea razor clam (<i>Ensis siliqua</i>) are assessed by annual survey. <b>This years estimated total biomass was 5,497 tonnes, 91% of which was above the 130 mm MLS</b>. In the North Irish Sea management is limited to 130mm shell length minimum landing size (MLS), fishing can only occur within areas classified (microbiologically) production areas, there is no fishing on Sunday and the fishery is closed by voluntary agreement in June. All vessels report GPS position at 10 minutes or higher frequency.</p>

<p>Many razor clam fisheries or potential fisheries occur within or close to Natura 2000 sites. The conservation objectives for species and habitats in these areas are integrated into razor clam fishery management advice.Ecosystem effects of fishing may include changes to the deep burrowing bivalve community in shallow sediments and potentially reduced prey availability to diving seaducks (Common Scoter) although this species feeds primarily on smaller bivalves at the sediment surface.</p>","<p>Razor clams (<i>Ensis siliqua</i>/<i>Ensis magnus</i>) are a species of deep burrowing bivalve inhabiting mixed sediments in shallow coastal water. Exact sediment requirements (grain size) varies by species. They are a component species of a deep burrowing megafauna community of species which also includes many other bivalve species such as otter shell (<i>Lutraria</i> sp), spiny cockle (<i>Acanthocardia</i> sp), blood razors (<i>Pharus legumen</i>) and Icelandic clam (<i>Arctica islandica</i>). They have a free swimming pelagic larval phase which aids dispersal although juvenile and adult clams may also swim and move to new locations. Growth is rapid in the first 3 years but slows with age; Clams at commercial size may be over 5 years. Spawning may occur from May to July. Maturation occurs below the minimum landing size of 130mm.</p>

","<p>Razor clams are fished mainly in shallow waters of the western Irish Sea from Dundalk Bay south to Malahide and also along the east Wexford coast. Fishing involves use of hydraulic non-suction dredges which fluidises sediment to a depth of 25cm in front of the dredge and dislodges clams that are then caught in the dredge. Fishing depth is limited by the functioning of the hydraulics and capacity to generate high water pressure at the dredge head. In the Irish Sea fishing occurs from the low water mark seaward to about 15m. Clams are landed and sold live mainly to the Asian market. There are about 70 vessels in the fishery. The fishery has expanded geographically and in total effort in recent years and is now a very important inshore fishery in the Irish Sea.</p>

<p>Smaller fisheries for razor clams occur on the west coast around Clifden Bay, Inisbofin, Killary, Iniskeas, Blacksod Bay, Broadhaven Bay and other areas. These have been fished under management plans in recent years but most are currently closed.</p>
","<p>A total of 805 tows were undertaken using five different vessels, with hydraulic dredges ranging from 0.92-1.2m width. GPS data for each tow line was recorded on a Trimble GPS survey unit. Following a standardized protocol applied to the 2017-2020 survey data, GPS tracks were inspected to identify potentially erroneous tracks due to lack of GPS track connectivity, and a Gaussian Kernel regression technique was applied as a way to smooth unrealistic spikes resulting from the position accuracy (1-3m) of the Trimble units. Based on the final track length and the gear width, swept area for each tow was estimated, resulting in a total sampling effort of 28,283 m<sup>2</sup>. </p>

<p>Biomass at each station was estimated as the product of density (number of individuals caught per meter squared towed area) and mean individual weight calculated from the size distribution at the station and a weight-length relationship. Biomass was then interpolated over a 200 m x 200 m grid using ordinary kriging on log(biomass). Total biomass was then estimated as the sum of mean estimated biomass, using a geostatistical (kriging) model, raised to the surface area of the cells. Ninety-five percent confidence intervals were estimated based upon 500 random realisations of the modelled biomass using conditional Gaussian simulations. This method preserves the spatial structure in the biomass, as described by variograms, which modelled the spatial autocorrelation and spatial structure in the survey data.</p> ","<p>Biomass of all size classes of razors uncorrected for dredge efficiency varied from 0.0023-0.33 kgs/m<sup>2</sup>. Distribution of high density patches is similar across size ranges. The estimated biomass was 5,497 tonnes, with 91% of the total biomass above the 130 mm MLS.</p>

<p>The size distribution of razor clams in the North Irish Sea in 2018 shows a rightward move due to growth with a main mode at ~140mm and an overall decrease in densities due to mortalities compared to the size profile observed in 2017. No sign of recruitment was observed. </p>
"
2018,Razor Clams,South Irish Sea,"<p>The Irish Sea razor clams (<i>Ensis siliqua</i>) are assessed by annual survey. <b>This years estimated biomass was 3,997 tonnes, 48% of which was above the 130 mm MLS</b>. In the South Irish Sea management measures include an MLS of 130 mm, fishing hours from 07:00 to 19:00, 2 tonne quota per vessel per week, 1 dredge per vessel not to exceed 122 cm width with bar spacing not less than 10 mm, prior notice of intention to fish and advance notice of landing, mandatory submission of gatherers docket information on landings, date and location of fishing and a defined fishing area to minimise overlap with Natura 2000 sites. All vessels report GPS position at 10 minutes or higher frequency.</p>

<p>Many razor clam fisheries or potential fisheries occur within or close to Natura 2000 sites. The conservation objectives for species and habitats in these areas are integrated into razor clam fishery management advice. Ecosystem effects of fishing may include changes to the deep burrowing bivalve community in shallow sediments and potentially reduced prey availability to diving seaducks (Common Scoter) although this species feeds primarily on smaller bivalves at the sediment surface.</p>","<p>Razor clams (<i>Ensis siliqua</i>/<i>Ensis magnus</i>) are a species of deep burrowing bivalve inhabiting mixed sediments in shallow coastal water. Exact sediment requirements (grain size) varies by species. They are a component species of a deep burrowing megafauna community of species which also includes many other bivalve species such as otter shell (<i>Lutraria</i> sp), spiny cockle (<i>Acanthocardia</i> sp), blood razors (<i>Pharus legumen</i>) and Icelandic clam (<i>Arctica islandica</i>). They have a free swimming pelagic larval phase which aids dispersal although juvenile and adult clams may also swim and move to new locations. Growth is rapid in the first 3 years but slows with age; clams at commercial size may be over 5 years. Spawning may occur from May to July. Maturation occurs below the minimum landing size of 130mm.</p>
","<p>Razor clams are fished mainly in shallow waters of the western Irish Sea from Dundalk Bay south to Malahide and also along the east Wexford coast. Fishing involves use of hydraulic non-suction dredges which fluidises sediment to a depth of 25cm in front of the dredge and dislodges clams that are then caught in the dredge. Fishing depth is limited by the functioning of the hydraulics and capacity to generate high water pressure at the dredge head. In the Irish Sea fishing occurs from the low water mark seaward to about 15m. Clams are landed and sold live mainly to the Asian market. There are about 70 vessels in the fishery. The fishery has expanded geographically and in total effort in recent years and is now a very important inshore fishery in the Irish Sea.</p>

<p>Smaller fisheries for razor clams occur on the west coast around Clifden Bay, Inisbofin, Killary, Iniskeas, Blacksod Bay, Broadhaven Bay and other areas. These have been fished under management plans in recent years but most are currently closed.</p>
","<p>The razor bed of Rosslare was surveyed in August 2018.  A total of 77 tows were undertaken, with a single toothless dredge of width 1.22m. GPS data for each tow line was recorded on a Trimble GPS survey unit and swept area for each tow estimated. The survey encompassed a combined area of 10.5 km<sup>2</sup> and a total sampling effort of 2,483m<sup>2</sup>.</p>

<p>Biomass at each station was estimated as the product of density (number of individuals caught per meter squared towed area) and mean individual weight calculated from the size distribution at the station and a weight-length relationship. Biomass was then interpolated over a grid using ordinary kriging on log(biomass). Total biomass was then estimated as the sum of mean estimated biomass, using a geostatistical (kriging) model, raised to the surface area of the cells. Ninety-five percent confidence intervals were estimated based upon random realisations of the modelled biomass using conditional Gaussian simulations. This method preserves the spatial structure in the biomass, as described by variograms, which modelled the spatial autocorrelation and spatial structure in the survey data.</p>","<p>Biomass of all size classes of razors uncorrected for dredge efficiency varied from 0.009-1.1 kgs/m<sup>2</sup>. Higher densities of razor clams across size classes  were found at the centre of the bed. </p>

<p>The estimated biomass was 3997 tonnes, almost half of which (48%) was above the 130 mm MLS.</p>

<p>The size distribution of razor clams in Rosslare in 2018 shows a rightward move indicative of growth with a main mode at almost 130mm. The incresed densities in the 2018 survey compared to 2017 might be an artifact of the higher catchability of larger razors. No recruitment signal is indicated as densities of small razor clams remains low.</p>
"
