Year,Specie,Area,ManagementAdvice,Biology,fishery,Assessment,Outputs
2021,Oyster,Clew Bay Westport,"<p>Native oyster (<i>Ostrea edulis</i>) stocks are in most cases managed locally by Oyster Co-operatives who have delegated authority to manage oysters in specific areas. The fishery is managed primarily by a minimum landing size (MLS) of 76-78 mm. The minimum size is generally reached at age 4-5. Oysters generally mature well below the MLS. Local quotas or TACs may be in force. The number of dredge permits issued annually to each co-operative by Inland Fisheries Ireland is limited.</p>

<p>Stocks are assessed by annual surveys which provide biomass estimates, although dredge efficiency (catchability) is uncertain. <b>Assuming a 35% dredge efficency, this years total biomass estimate was 18 tonnes, 59% of which was above the 76mm MLS</b>. Stock biomass is generally depleted in all areas, except inner Tralee Bay, and management measures to restore recruitment and re-build spawning stocks are necessary. Various threats to native oyster stocks exist including naturalisation of Pacific oyster (<i>Magallana gigas</i>), Bonamia infection, poor water quality, unfavourable habitat conditions for settlement and low spawning stocks. Pacific oyster has naturalised in Lough Swilly in recent years and supports a commercial fishery.</p>

<p>Generally, although seasonal quotas and minimum size regulations are in place for some fisheries, management plans or recovery plans should be developed in order to restore productivity of stocks. A range of actions should be considered including areas closed to fishing where spawning stock could be re-built, removal of Pacific oysters, maintenance or recovery of habitat for settlement, development of harvest control rules and improving operational management locally. Draft management plans are in place for a number of co-operatives as of 2023.</p>

<p>Oyster beds are also constituents of habitats designated under the Habitats Directive in many areas. Specific conservation objectives have been defined for these habitats in some sites. Oyster management plans also need to consider the conservation objectives for oyster habitat or for habitat in which oyster is a characterising species.</p>
","<p>Native oysters (<i>Ostrea edulis</i>) are bivalve molluscs. Oysters are a protandric hermaphrodite species, meaning they mature first as a male and then have the ability to change between male and female later in life. Males release sperm into the water column and females brood the fertilised eggs in their gills. One female can produce 500,000 to 1 million larvae in a spawning season after brooding the eggs for 8-10days in their gills.</p>

<p>Native oysters are filter feeders, consuming plankton and detritus from the water column. They are predated on by various species, including humans, crabs, whelks and starfish. They are often referred to as &#39;ecosystem engineers&#39; because of the important ecosystem service they provide, including creating reef habitats which attracts other species and can protect against coastal erosion and improve water quality through filter feeding.</p>

<p>The distribution of native oysters extends from the Norwegian Sea in the North, the Southern North Sea, around Ireland and Britain and south as far as the Mediterranean Sea, naturally inhabiting lower intertidal and shallow subtital habitats. In oyster sites on the west coast of Ireland, spawning occurs frequently if not annually and larval settlement is dependent on seawater temperatures in mid summer. Growth is seasonal, with a significant increase during the summer months and slow or even negative growth (due to shell edge erosion) in winter.</p>

","<p>Oysters are fished with simple light weight dredges fitted with a blade or toothed bar depending on area of fishing and ground type. The vessels involved can vary from 5-6 m open punts to half deckers between 8-14 m. The fishing season may be written into the fishery orders eg Galway Bay is open to fishing in December only. In other cases fishing generally occurs from September to January. Fishing may not occur every year and in recent years there has been no fishing in many areas because of low stock levels. Oysters are usually sold centrally through the co-operatives.</p>

<p>Native oyster stocks were extirpated from large areas of the north Sea and Irish Sea by fishing in the 19<sup>th</sup> century. Overfishing in coastal areas has also led to decline in coastal beds. Since the 1980s this decline was exacerbated following the accidental introduction of the haplosporidian parasite <i>Bonamia ostrea</i>.</p>
","<p>A total of 39 tows were undertaken in 3 beds in Westport Bay using a single toothless dredge 1.2m in width, encompassing a combined surveyed area of 0.53Km<sup>2</sup>, with a total sampling effort of 3275m<sup>2</sup>.</p> 

<p>GPS data for each tow line was recorded on a Trimble GPS survey unit and swept area for each tow estimated. The density (number of oysters per m<sup>2</sup>) for each tow was calculated by multiplying the area of each tow by the number of oysters caught. The densities were subsequently interpolated using an Inverse Distance Weighting (IDW) algorithm. Contours were drawn at intervals reflecting the range in observed densities. A dredge efficiency co-efficient of 35% was applied to assessment outputs, calculated as the average of different dredge efficiency experiments in oyster beds around Ireland.</p>","<p>The biomass of oysters in Westport Bay, uncorrected for dredge efficiency, was 6.3&#177;1.1 tonnes, with densities ranging from 0-3.55 oyster/m<sup>2</sup>. Higher densities of all size classes of oysters occurred in the two smaller beds in the north of the bay, whereas oysters >76mm were more abundant in the larger bed to the south. Assuming a dredge efficiency of 35%, estimated biomass was 18&#177;3.2 tonnes with densities ranging from 0-10.2 oyster/m<sup>2</sup>. Biomass of Oysters >76mm was estimated to 10.7&#177;1.8 tonnes.</p>  "
2020,Cockle,Dundalk,"<p>The Dundalk Bay cockle (<i>Cerastoderma edule</i>) fishery is managed under a Fisheries Natura (management) Plan (FNP) which is a legal mechanism to incorporate environmental protection measures into fisheries management plans when such fisheries occur in Natura 2000 sites.  Harvest control rules are implemented through annual legislation in the form of Natura Declarations (<a href= ""http://www.fishingnet.ie/""> fishing.ie</a>). These plans were subject to screening and appropriate assessment as required by the EU Habitats Directive Article 6 and the EU Birds and Habitats Regulations (S.I. 290 of 2013).</p> 

<p>The stock is assessed by annual survey. Trends in other ecosystem indicators (benthic habitats, bird populations) are integrated into management advice and the FNP.</p>

<p>Annual TAC is set according to harvest control rules defined in the FNP (<a href=""http://www.fishingnet.ie/sea-fisheriesinnaturaareas/concludedassessments/dundalkbay-sacspa/"">available here</a>) and based on the biomass estimated from a mid-summer survey.  <b>This years survey biomass estimate was 3,420 tonnes, from which 2,350 tonnes were above the minimum landing size</b>. There is no fishing at biomass below 750 tonnes. TACs of 33 % of biomass apply between 750 and 3000 tonnes. TAC of 50% of biomass applies when biomass exceeds 3000 tonnes. The fishery closes if the average catch per boat per day declines to 250 kg even if the TAC is not taken. This provides additional precaution given uncertainty in the survey estimates. Opening and closing dates are specified annually. The latest closing date of November 1<sup>st</sup> is implemented even if the TAC has not been taken or if the catch rate remains above the limit for closure. A quota of 1 tonne per vessel per day for 28 permit holders is in force. Vessels can fish between the hours of 06:00 and 22:00. Dredge width should not exceed 0.75 m in the case of suction dredges and 1.0 m for non-suction dredges. The national minimum legal landing size is 17 mm but operationally and by agreement of the licence holders the minimum size landed in Dundalk Bay is 22 mm. This is implemented by using 22 mm bar spacing on drum graders on board the vessels.</p> 

<p>Environmental performance indicators are reviewed annually as part of the management plans and the prospect of an annual fishery depends on annual evidence that there is no causal link between cockle fishing and, in particular, the abundance of oystercatcher and other species of bird that feed on bivalves and the status of characterising bivalve species in intertidal habitats. Overfishing of cockles can have catastrophic effects on bird populations leading to displacement from the site, mortality or reduced reproductive fitness.</p>

<p>Maintenance of favourable conservation status of intertidal habitats in which cockle fisheries occur is a primary management objective in order to reduce the risk of future recruitment failure and to ensure that conservation objectives for designated habitats and species are protected. Any cockle fisheries in other SACs or SPAs should be subject to management plans considering their potential effects on designated habitats and birds.</p>
",<p>Cockles (<i>Cerastoderma edule</i>) are a shallow burrowing bivalve inhabiting mixed sediments in intertidal estuaries and mudflats. Cockles have a free swimming pelagic larval phase and settlement of new recruits can occur in spring and autumn. Recruitment is strongly linked to environmental conditions during the larval phase. In Dundalk Bay growth is fast and commercial size (17mm) can be attained after 1 winter. This is a significant reason why the stock can support a fishery given that natural mortality can be extremely high overwinter. Winter mortality is caused mainly by bird predation but also extreme weather events.</p>,"<p>The only significant fishery for cockles in Ireland occurs in Dundalk Bay. There are many cockle beds in other Irish coastal areas but none provide sufficiently stable conditions (stock biomass) for fishing. Fishing involves the use of suction and non-suction hydraulic dredges which penetrate the sediment to a depth of approximately 5cm. Hand gathering permits have been issued in the past in Dundalk. The Dundalk fishery occurs in early autumn and includes 28 permit holders. Landings vary annually from 0-700 tonnes depending on stock biomass. Cockles are sold to the UK and to Europe. </p>

","<p>A pre-fishery survey was completed between May 31<sup>st</sup>-June 4<sup>th</sup> 2020. A total of 346 stations, were sampled, using two different gears: scientific quadrats covering an area 0.25 m<sup>2</sup> and rakes covering an area of 2 m<sup>2</sup>, making a total of 776.5m<sup>2</sup> of sampled area (two hand rake stations were sampled only 1m2). GPS locations from each stations were recorded using Trimble GPS units. The total area surveyed was 27.2 km<sup>2</sup>.</p> 

<p>Biomass at each station was estimated based on density (number of individuals caught per square metre of sampled area) and a species specific weight-length relationship. Total biomass was then estimated as the sum of mean estimated biomass, using a geostatistical (kriging) model with a zone effect (between the Northern and Southern areas), raised to the surface area.</p> ","<p>Total biomass was 3,420 tonnes based on a Geostatistical model. Biomass of cockles over 22 mm was 2,350 tonnes. The highest densities (kgs/m<sup>2</sup>) of cockles occurred throughout the middle of the surveyed area, with two visible hotspots at the north and south limits of the southern zone.</p> 

<p>Compared to 2019 surveyed data, the cockle size distribution in 2020 shifted towards the right hand side of the distribution. The modal size distribution in the 2020 cockle data survey is approximately 24 mm compared to 18 mm in 2019. The majority of the cockles observed in 2020 were above the MLS of 18 mm. No strong recruitment signal was detected during the 2020 survey data. </p>"
2020,Razor Clams,South Irish Sea,"<p>The Irish Sea razor clams (<i>Ensis siliqua</i>) are assessed by annual survey. <b>This years estimated biomass was 6,330 tonnes, 87.6% of which was above the 130 mm MLS</b>. In the South Irish Sea management measures include an MLS of 130 mm, fishing hours from 07:00 to 19:00, 2 tonne quota per vessel per week, 1 dredge per vessel not to exceed 122 cm width with bar spacing not less than 10 mm, prior notice of intention to fish and advance notice of landing, mandatory submission of gatherers docket information on landings, date and location of fishing and a defined fishing area to minimise overlap with Natura 2000 sites. All vessels report GPS position at 10 minutes or higher frequency.</p>

<p>Many razor clam fisheries or potential fisheries occur within or close to Natura 2000 sites. The conservation objectives for species and habitats in these areas are integrated into razor clam fishery management advice. Ecosystem effects of fishing may include changes to the deep burrowing bivalve community in shallow sediments and potentially reduced prey availability to diving seaducks (Common Scoter) although this species feeds primarily on smaller bivalves at the sediment surface.</p>","<p>Razor clams (<i>Ensis siliqua</i>/<i>Ensis magnus</i>) are a species of deep burrowing bivalve inhabiting mixed sediments in shallow coastal water. Exact sediment requirements (grain size) varies by species. They are a component species of a deep burrowing megafauna community of species which also includes many other bivalve species such as otter shell (<i>Lutraria</i> sp), spiny cockle (<i>Acanthocardia</i> sp), blood razors (<i>Pharus legumen</i>) and Icelandic clam (<i>Arctica islandica</i>). They have a free swimming pelagic larval phase which aids dispersal although juvenile and adult clams may also swim and move to new locations. Growth is rapid in the first 3 years but slows with age; clams at commercial size may be over 5 years. Spawning may occur from May to July. Maturation occurs below the minimum landing size of 130mm.</p>
","<p>Razor clams are fished mainly in shallow waters of the western Irish Sea from Dundalk Bay south to Malahide and also along the east Wexford coast. Fishing involves use of hydraulic non-suction dredges which fluidises sediment to a depth of 25cm in front of the dredge and dislodges clams that are then caught in the dredge. Fishing depth is limited by the functioning of the hydraulics and capacity to generate high water pressure at the dredge head. In the Irish Sea fishing occurs from the low water mark seaward to about 15m. Clams are landed and sold live mainly to the Asian market. There are about 70 vessels in the fishery. The fishery has expanded geographically and in total effort in recent years and is now a very important inshore fishery in the Irish Sea.</p>

<p>Smaller fisheries for razor clams occur on the west coast around Clifden Bay, Inisbofin, Killary, Iniskeas, Blacksod Bay, Broadhaven Bay and other areas. These have been fished under management plans in recent years but most are currently closed.</p>
","<p>The razor bed of Rosslare was surveyed on September 7th and 8th 2020.  A total of 49 tows were undertaken, with a single toothless dredge of width 1.06m. GPS data for each tow line was recorded on a Trimble GPS survey unit and swept area for each tow estimated. The survey encompassed a combined area of 13.6 km<sup>2</sup> and a total sampling effort of 1,181m<sup>2</sup>.</p>

<p>Biomass at each station was estimated as the product of density (number of individuals caught per meter squared towed area) and mean individual weight calculated from the size distribution at the station and a weight-length relationship. Biomass was then interpolated over a grid using ordinary kriging on log(biomass). Total biomass was then estimated as the sum of mean estimated biomass, using a geostatistical (kriging) model, raised to the surface area of the cells. Ninety-five percent confidence intervals were estimated based upon random realisations of the modelled biomass using conditional Gaussian simulations. This method preserves the spatial structure in the biomass, as described by variograms, which modelled the spatial autocorrelation and spatial structure in the survey data.</p>","<p>Biomass of all size classes of razors uncorrected for dredge efficiency varied from 0-1.7 kgs/m<sup>2</sup>. Higher densities of razor clams <130 mm MLS are found at the centre of the bed, whereas razors >150 mm are more abundant towards the northern side of the surveyed area . </p>

<p>The estimated biomass was 6,330 tonnes, almost all of which (87.6%) was above the 130 mm MLS.</p>

<p>The size distribution of razor clams in Rosslare in 2020 shows a very similar pattern with the survey carried in 2019, with no apparent growth and a modal size at approximately 140 mm. No recruitment signal is indicated as densities of small razor clams remains low.</p>
"
2020,Razor Clams,North Irish Sea,"<p>The Irish Sea razor clam (<i>Ensis siliqua</i>) are assessed by annual survey. <b>This years estimated total biomass was 6,542 tonnes, 80% of which was above the 130 mm MLS</b>. In the North Irish Sea management is limited to 130mm shell length minimum landing size (MLS), fishing can only occur within areas classified (microbiologically) production areas, there is no fishing on Sunday and the fishery is closed by voluntary agreement in June. All vessels report GPS position at 10 minutes or higher frequency.</p>

<p>Many razor clam fisheries or potential fisheries occur within or close to Natura 2000 sites. The conservation objectives for species and habitats in these areas are integrated into razor clam fishery management advice.Ecosystem effects of fishing may include changes to the deep burrowing bivalve community in shallow sediments and potentially reduced prey availability to diving seaducks (Common Scoter) although this species feeds primarily on smaller bivalves at the sediment surface.</p>","<p>Razor clams (<i>Ensis siliqua</i>/<i>Ensis magnus</i>) are a species of deep burrowing bivalve inhabiting mixed sediments in shallow coastal water. Exact sediment requirements (grain size) varies by species. They are a component species of a deep burrowing megafauna community of species which also includes many other bivalve species such as otter shell (<i>Lutraria</i> sp), spiny cockle (<i>Acanthocardia</i> sp), blood razors (<i>Pharus legumen</i>) and Icelandic clam (<i>Arctica islandica</i>). They have a free swimming pelagic larval phase which aids dispersal although juvenile and adult clams may also swim and move to new locations. Growth is rapid in the first 3 years but slows with age; Clams at commercial size may be over 5 years. Spawning may occur from May to July. Maturation occurs below the minimum landing size of 130mm.</p>

","<p>Razor clams are fished mainly in shallow waters of the western Irish Sea from Dundalk Bay south to Malahide and also along the east Wexford coast. Fishing involves use of hydraulic non-suction dredges which fluidises sediment to a depth of 25cm in front of the dredge and dislodges clams that are then caught in the dredge. Fishing depth is limited by the functioning of the hydraulics and capacity to generate high water pressure at the dredge head. In the Irish Sea fishing occurs from the low water mark seaward to about 15m. Clams are landed and sold live mainly to the Asian market. There are about 70 vessels in the fishery. The fishery has expanded geographically and in total effort in recent years and is now a very important inshore fishery in the Irish Sea.</p>

<p>Smaller fisheries for razor clams occur on the west coast around Clifden Bay, Inisbofin, Killary, Iniskeas, Blacksod Bay, Broadhaven Bay and other areas. These have been fished under management plans in recent years but most are currently closed.</p>
","<p>A total of 777 tows were undertaken using five different vessels, with hydraulic dredges ranging from 0.81-1.1m width. GPS data for each tow line was recorded on a Trimble GPS survey unit. Following a standardized protocol applied to the 2017-2020 survey data, GPS tracks were inspected to identify potentially erroneous tracks due to lack of GPS track connectivity, and a Gaussian Kernel regression technique was applied as a way to smooth unrealistic spikes resulting from the position accuracy (1-3m) of the Trimble units. Based on the final track length and the gear width, swept area for each tow was estimated, resulting in a total sampling effort of 20,695 m<sup>2</sup>. </p>

<p>Biomass at each station was estimated as the product of density (number of individuals caught per meter squared towed area) and mean individual weight calculated from the size distribution at the station and a weight-length relationship. Biomass was then interpolated over a 200 m x 200 m grid using ordinary kriging on log(biomass). Total biomass was then estimated as the sum of mean estimated biomass, using a geostatistical (kriging) model, raised to the surface area of the cells. Ninety-five percent confidence intervals were estimated based upon 500 random realisations of the modelled biomass using conditional Gaussian simulations. This method preserves the spatial structure in the biomass, as described by variograms, which modelled the spatial autocorrelation and spatial structure in the survey data.</p> ","<p>Biomass of all size classes of razors uncorrected for dredge efficiency varied from 0.0031-0.21 kgs/m<sup>2</sup>. Distribution of high density patches is similar across size ranges. The estimated biomass was 6,542 tonnes, with 90% of the total biomass above the 130 mm MLS.</p>

<p>The size distribution of razor clams in the North Irish Sea in 2020 shows a rightward move due to growth in the ~150mm cohort observed in the 2019 survey. A small recruitment signal is observed. </p>
"
