Year,Specie,Area,ManagementAdvice,Biology,fishery,Assessment,Outputs
2023,Oyster,Clew Bay Westport,"<p>Native oyster (<i>Ostrea edulis</i>) stocks are in most cases managed locally by Oyster Co-operatives who have delegated authority to manage oysters in specific areas. The fishery is managed primarily by a minimum landing size (MLS) of 76-78 mm. The minimum size is generally reached at age 4-5. Oysters generally mature well below the MLS. Local quotas or TACs may be in force. The number of dredge permits issued annually to each co-operative by Inland Fisheries Ireland is limited.</p>

<p>Stocks are assessed by annual surveys which provide biomass estimates, although dredge efficiency (catchability) is uncertain. <b>Assuming a 35% dredge efficency, this years total biomass estimate was 22.6 tonnes, 22% of which was above the 76mm MLS</b>. Stock biomass is generally depleted in all areas, except inner Tralee Bay, and management measures to restore recruitment and re-build spawning stocks are necessary. Various threats to native oyster stocks exist including naturalisation of Pacific oyster (<i>Magallana gigas</i>), Bonamia infection, poor water quality, unfavourable habitat conditions for settlement and low spawning stocks. Pacific oyster has naturalised in Lough Swilly in recent years and supports a commercial fishery.</p>

<p>Generally, although seasonal quotas and minimum size regulations are in place for some fisheries, management plans or recovery plans should be developed in order to restore productivity of stocks. A range of actions should be considered including areas closed to fishing where spawning stock could be re-built, removal of Pacific oysters, maintenance or recovery of habitat for settlement, development of harvest control rules and improving operational management locally. Draft management plans are in place for a number of co-operatives as of 2023.</p>

<p>Oyster beds are also constituents of habitats designated under the Habitats Directive in many areas. Specific conservation objectives have been defined for these habitats in some sites. Oyster management plans also need to consider the conservation objectives for oyster habitat or for habitat in which oyster is a characterising species.</p>
","<p>Native oysters (<i>Ostrea edulis</i>) are bivalve molluscs. Oysters are a protandric hermaphrodite species, meaning they mature first as a male and then have the ability to change between male and female later in life. Males release sperm into the water column and females brood the fertilised eggs in their gills. One female can produce 500,000 to 1 million larvae in a spawning season after brooding the eggs for 8-10days in their gills.</p>

<p>Native oysters are filter feeders, consuming plankton and detritus from the water column. They are predated on by various species, including humans, crabs, whelks and starfish. They are often referred to as &#39;ecosystem engineers&#39; because of the important ecosystem service they provide, including creating reef habitats which attracts other species and can protect against coastal erosion and improve water quality through filter feeding.</p>

<p>The distribution of native oysters extends from the Norwegian Sea in the North, the Southern North Sea, around Ireland and Britain and south as far as the Mediterranean Sea, naturally inhabiting lower intertidal and shallow subtital habitats. In oyster sites on the west coast of Ireland, spawning occurs frequently if not annually and larval settlement is dependent on seawater temperatures in mid summer. Growth is seasonal, with a significant increase during the summer months and slow or even negative growth (due to shell edge erosion) in winter.</p>

","<p>Oysters are fished with simple light weight dredges fitted with a blade or toothed bar depending on area of fishing and ground type. The vessels involved can vary from 5-6 m open punts to half deckers between 8-14 m. The fishing season may be written into the fishery orders eg Galway Bay is open to fishing in December only. In other cases fishing generally occurs from September to January. Fishing may not occur every year and in recent years there has been no fishing in many areas because of low stock levels. Oysters are usually sold centrally through the co-operatives.</p>

<p>Native oyster stocks were extirpated from large areas of the north Sea and Irish Sea by fishing in the 19<sup>th</sup> century. Overfishing in coastal areas has also led to decline in coastal beds. Since the 1980s this decline was exacerbated following the accidental introduction of the haplosporidian parasite <i>Bonamia ostrea</i>.</p>
","<p>A survey was carried out on 5<sup>th</sup> December on the oyster beds in the Westport area of Clew Bay.  A total of 71 tows were undertaken covering four oyster beds with a single toothless dredge (blade) of width 1.22m. One of the oyster beds, where 9 tows were conducted, was excluded from the assessment to provide a better comparison with the area covered in 2022. The final combined survey area was 1.33km<sup>2</sup>, with a total sampling effort of 6554m<sup>2</sup>. </p> 

<p>GPS data for each tow line was recorded on a Trimble GPS survey unit and swept area for each tow estimated. The density (number of oysters per m<sup>2</sup>) for each tow was calculated by multiplying the area of each tow by the number of oysters caught. The densities were subsequently interpolated using an Inverse Distance Weighting (IDW) algorithm. Contours were drawn at intervals reflecting the range in observed densities. A dredge efficiency co-efficient of 35% was applied to assessment outputs, calculated as the average of different dredge efficiency experiments in oyster beds around Ireland.</p>","<p>The biomass of oysters in Westport Bay, uncorrected for dredge efficiency was 7.8&#177;3.1 tonnes, with densities ranging from 0-3.78 oyster/m<sup>2</sup>. Higher densities of all oysters occurred in the most northerly bed, whereas oysters >76mm were more evenly distributed across the two larger beds . Assuming a dredge efficiency of 35%, estimated biomass was 22.6&#177;8.9 tonnes with densities ranging from 0-10.8 oyster/m<sup>2</sup>. Biomass of oysters >76mm, assuming a dredge efficiency of 35%, was estimated to 4.9&#177;1.1 tonnes, representing 22% of the total biomass. The biomass estimates for Westport Bay in 2023 are very similar to estimates from 2022, but the survey area in 2023 is more than double that of 2022 so despite the steady biomass across the two years, more effort was needed to catch the same weight of oysters this year.</p> "
2023,Oyster,Fenit,"<p>Native oyster (<i>Ostrea edulis</i>) stocks are in most cases managed locally by Oyster Co-operatives who have delegated authority to manage oysters in specific areas. The fishery is managed primarily by a minimum landing size (MLS) of 76-78 mm. The minimum size is generally reached at age 4-5. Oysters generally mature well below the MLS. Local quotas or TACs may be in force. The number of dredge permits issued annually to each co-operative by Inland Fisheries Ireland is limited.</p>

<p>Stocks are assessed by annual surveys which provide biomass estimates, although dredge efficiency (catchability) is uncertain. <b>Assuming a 35% dredge efficency, this years total biomass estimate was 891 tonnes, 37% of which was above the 76mm MLS</b>. Stock biomass is generally depleted in all areas, except inner Tralee Bay, and management measures to restore recruitment and re-build spawning stocks are necessary. Various threats to native oyster stocks exist including naturalisation of Pacific oyster (<i>Magallana gigas</i>), Bonamia infection, poor water quality, unfavourable habitat conditions for settlement and low spawning stocks. Pacific oyster has naturalised in Lough Swilly in recent years and supports a commercial fishery.</p>

<p>Generally, although seasonal quotas and minimum size regulations are in place for some fisheries, management plans or recovery plans should be developed in order to restore productivity of stocks. A range of actions should be considered including areas closed to fishing where spawning stock could be re-built, removal of Pacific oysters, maintenance or recovery of habitat for settlement, development of harvest control rules and improving operational management locally. Draft management plans are in place for a number of co-operatives as of 2023.</p>

<p>Oyster beds are also constituents of habitats designated under the Habitats Directive in many areas. Specific conservation objectives have been defined for these habitats in some sites. Oyster management plans also need to consider the conservation objectives for oyster habitat or for habitat in which oyster is a characterising species.</p>
","<p>Native oysters (<i>Ostrea edulis</i>) are bivalve molluscs. Oysters are a protandric hermaphrodite species, meaning they mature first as a male and then have the ability to change between male and female later in life. Males release sperm into the water column and females brood the fertilised eggs in their gills. One female can produce 500,000 to 1 million larvae in a spawning season after brooding the eggs for 8-10days in their gills.</p>

<p>Native oysters are filter feeders, consuming plankton and detritus from the water column. They are predated on by various species, including humans, crabs, whelks and starfish. They are often referred to as &#39;ecosystem engineers&#39; because of the important ecosystem service they provide, including creating reef habitats which attracts other species and can protect against coastal erosion and improve water quality through filter feeding.</p>

<p>The distribution of native oysters extends from the Norwegian Sea in the North, the Southern North Sea, around Ireland and Britain and south as far as the Mediterranean Sea, naturally inhabiting lower intertidal and shallow subtital habitats. In oyster sites on the west coast of Ireland, spawning occurs frequently if not annually and larval settlement is dependent on seawater temperatures in mid summer. Growth is seasonal, with a significant increase during the summer months and slow or even negative growth (due to shell edge erosion) in winter.</p>

","<p>Oysters are fished with simple light weight dredges fitted with a blade or toothed bar depending on area of fishing and ground type. The vessels involved can vary from 5-6 m open punts to half deckers between 8-14 m. The fishing season may be written into the fishery orders eg Galway Bay is open to fishing in December only. In other cases fishing generally occurs from September to January. Fishing may not occur every year and in recent years there has been no fishing in many areas because of low stock levels. Oysters are usually sold centrally through the co-operatives.</p>

<p>Native oyster stocks were extirpated from large areas of the north Sea and Irish Sea by fishing in the 19<sup>th</sup> century. Overfishing in coastal areas has also led to decline in coastal beds. Since the 1980s this decline was exacerbated following the accidental introduction of the haplosporidian parasite <i>Bonamia ostrea</i>.</p>
","<p>A pre fishery survey was carried out on 11<sup>th</sup> and 12<sup>th</sup> September on the Fenit Oyster Bed.  A total of 76 tows were undertaken, with a single toothless dredge of width 1.22 m. GPS data for each tow track was recorded on a Trimble GPS survey unit and swept area for each tow estimated. The survey encompassed an area of 4.49 km<sup>2</sup> east of Fenit pier. </p>","<p>Biomass of oysters uncorrected for dredge efficiency varied from 0-0.38 kgs/m<sup>2</sup>. Biomass of oysters over 76 mm ranged from 0-0.11 kgs/m<sup>2</sup>. Total biomass of oysters, assuming a dredge efficiency of 35%, was 891 tonnes. The equivalent biomass of oysters 76 mm or over was 331 tonnes or approximately 37% of the total biomass.The size distribution of oysters caught during the survey showed a strong mode at approximately 71 mm slightly smaller than the predominate mode of 75 mm in 2022. There was a weak signal of in year settlement at about 10 mm. Two smaller modes were also visible at 31 mm and 41 mm.</p>"
2023,Razor Clams,South Irish Sea,"<p>The Irish Sea razor clams (<i>Ensis siliqua</i>) are assessed by annual survey.<b>This years estimated biomass was 5,001 tonnes, 92% of which was above the 130 mm MLS</b>. In the South Irish Sea management measures include an MLS of 130 mm, fishing hours from 07:00 to 19:00, 2 tonne quota per vessel per week, 1 dredge per vessel not to exceed 122 cm width with bar spacing not less than 10 mm, prior notice of intention to fish and advance notice of landing, mandatory submission of gatherers docket information on landings, date and location of fishing and a defined fishing area to minimise overlap with Natura 2000 sites. All vessels report GPS position at 10 minutes or higher frequency.</p>

<p>Many razor clam fisheries or potential fisheries occur within or close to Natura 2000 sites. The conservation objectives for species and habitats in these areas are integrated into razor clam fishery management advice. Ecosystem effects of fishing may include changes to the deep burrowing bivalve community in shallow sediments and potentially reduced prey availability to diving seaducks (Common Scoter) although this species feeds primarily on smaller bivalves at the sediment surface.</p>","<p>Razor clams (<i>Ensis siliqua</i>/<i>Ensis magnus</i>) are a species of deep burrowing bivalve inhabiting mixed sediments in shallow coastal water. Exact sediment requirements (grain size) varies by species. They are a component species of a deep burrowing megafauna community of species which also includes many other bivalve species such as otter shell (<i>Lutraria</i> sp), spiny cockle (<i>Acanthocardia</i> sp), blood razors (<i>Pharus legumen</i>) and Icelandic clam (<i>Arctica islandica</i>). They have a free swimming pelagic larval phase which aids dispersal although juvenile and adult clams may also swim and move to new locations. Growth is rapid in the first 3 years but slows with age; clams at commercial size may be over 5 years. Spawning may occur from May to July. Maturation occurs below the minimum landing size of 130mm.</p>
","<p>Razor clams are fished mainly in shallow waters of the western Irish Sea from Dundalk Bay south to Malahide and also along the east Wexford coast. Fishing involves use of hydraulic non-suction dredges which fluidises sediment to a depth of 25cm in front of the dredge and dislodges clams that are then caught in the dredge. Fishing depth is limited by the functioning of the hydraulics and capacity to generate high water pressure at the dredge head. In the Irish Sea fishing occurs from the low water mark seaward to about 15m. Clams are landed and sold live mainly to the Asian market. There are about 70 vessels in the fishery. The fishery has expanded geographically and in total effort in recent years and is now a very important inshore fishery in the Irish Sea.</p>

<p>Smaller fisheries for razor clams occur on the west coast around Clifden Bay, Inisbofin, Killary, Iniskeas, Blacksod Bay, Broadhaven Bay and other areas. These have been fished under management plans in recent years but most are currently closed.</p>
","<p>The razor bed of Rosslare was surveyed on September 1<sup>st</sup> and 7<sup>th</sup> 2023.  A total of 44 tows were undertaken, with a single hydraulic dredge of width 1.25m. GPS data for each tow line was recorded on a Trimble GPS survey unit and swept area for each tow was estimated. The survey encompassed a total area of 12.1km<sup>2</sup> and a total sampling effort of 1318m<sup>2</sup>.</p>

<p>Biomass at each station was estimated as the product of density (number of individuals caught per meter squared towed area) and mean individual weight calculated from the size distribution at the station and a weight-length relationship. Biomass was then interpolated over a grid using ordinary kriging on log(biomass). Total biomass was then estimated as the sum of mean estimated biomass, using a geostatistical (kriging) model, raised to the surface area of the cells. Ninety-five percent confidence intervals were estimated based upon random realisations of the modelled biomass using conditional Gaussian simulations. This method preserves the spatial structure in the biomass, as described by variograms, which modelled the spatial autocorrelation and spatial structure in the survey data.</p>","<p>Biomass of all size classes of razors, assuming a dredge efficiency of 100%, varied from 0-1.3 kgs/m<sup>2</sup>. Higher densities of razor clams where found at the centre of the bed across size classes. </p>

<p>The estimated biomass was 5001 tonnes, almost all of which (92%) was above the 130 mm MLS. </p>

<p>The size distribution of razor clams showed a decrease in densities and a slight move rightwards in the modal sizes compared to the survey carried in 2022. No evidence of any significant recruitment was found as densities of small razor clams were low.</p>
"
2023,Razor Clams,North Irish Sea,"<p>The Irish Sea razor clam (<i>Ensis siliqua</i>) are assessed by annual survey. In the North Irish Sea, since 2022, management now includes a total allowable catch (TAC), a 600kg  landing limit per boat per week in the North Irish Sea, 130mm shell length minimum landing size (MLS), fishing can only occur within areas classified (microbiologically) production areas, there is no fishing on Sunday and the fishery is closed by voluntary agreement in June. The TAC is based on a harvest control rule applied to the annual survey biomass estimates. <b>This years estimated total biomass was 8,792 tonnes,  90% of which was above the 130 mm MLS</b>. All vessels report GPS position at 10 minutes or higher frequency.</p>

<p>Many razor clam fisheries or potential fisheries occur within or close to Natura 2000 sites. The conservation objectives for species and habitats in these areas are integrated into razor clam fishery management advice.Ecosystem effects of fishing may include changes to the deep burrowing bivalve community in shallow sediments and potentially reduced prey availability to diving seaducks (Common Scoter) although this species feeds primarily on smaller bivalves at the sediment surface.</p>","<p>Razor clams (<i>Ensis siliqua</i>/<i>Ensis magnus</i>) are a species of deep burrowing bivalve inhabiting mixed sediments in shallow coastal water. Exact sediment requirements (grain size) varies by species. They are a component species of a deep burrowing megafauna community of species which also includes many other bivalve species such as otter shell (<i>Lutraria</i> sp), spiny cockle (<i>Acanthocardia</i> sp), blood razors (<i>Pharus legumen</i>) and Icelandic clam (<i>Arctica islandica</i>). They have a free swimming pelagic larval phase which aids dispersal although juvenile and adult clams may also swim and move to new locations. Growth is rapid in the first 3 years but slows with age; Clams at commercial size may be over 5 years. Spawning may occur from May to July. Maturation occurs below the minimum landing size of 130mm.</p>

","<p>Razor clams are fished mainly in shallow waters of the western Irish Sea from Dundalk Bay south to Malahide and also along the east Wexford coast. Fishing involves use of hydraulic non-suction dredges which fluidises sediment to a depth of 25cm in front of the dredge and dislodges clams that are then caught in the dredge. Fishing depth is limited by the functioning of the hydraulics and capacity to generate high water pressure at the dredge head. In the Irish Sea fishing occurs from the low water mark seaward to about 15m. Clams are landed and sold live mainly to the Asian market. There are about 70 vessels in the fishery. The fishery has expanded geographically and in total effort in recent years and is now a very important inshore fishery in the Irish Sea.</p>

<p>Smaller fisheries for razor clams occur on the west coast around Clifden Bay, Inisbofin, Killary, Iniskeas, Blacksod Bay, Broadhaven Bay and other areas. These have been fished under management plans in recent years but most are currently closed.</p>
","<p>A total of 771 tows were undertaken using five different vessels, with hydraulic dredges ranging from 0.86-1.2m width. GPS data for each tow line was recorded on a Trimble GPS survey unit. Following a standardized protocol applied to the 2017-2021 survey data, GPS tracks were inspected to identify potentially erroneous tracks due to lack of GPS track connectivity, and a Gaussian Kernel regression technique was applied as a way to smooth unrealistic spikes resulting from the position accuracy (1-3m) of the Trimble units. Based on the final track length and the gear width, swept area for each tow was estimated, resulting in a total sampling effort of 21233 m<sup>2</sup>.</p>

<p>Biomass at each station was estimated as the product of density (number of individuals caught per meter squared towed area) and mean individual weight calculated from the size distribution at the station and a weight-length relationship. Biomass was then interpolated over a 200 m x 200 m grid using ordinary kriging on log(biomass). Total biomass was then estimated as the sum of mean estimated biomass, using a geostatistical (kriging) model, raised to the surface area of the cells. Ninety-five percent confidence intervals were estimated based upon random realisations of the modelled biomass using conditional Gaussian simulations. This method preserves the spatial structure in the biomass, as described by variograms, which modelled the spatial autocorrelation and spatial structure in the survey data.</p>
","<p>Biomass of all size classes of razors uncorrected for dredge efficiency varied from 0-0.5 kgs/m<sup>2</sup>. The distribution of high density patches was similar across size ranges up to 160mm. Razors above 180 mm and 200 mm were more abundant in the northern limit of the survey zone (Dundalk), and at Gormanstown just north of Drogheda. The estimated total biomass was 8,792 tonnes, with 90 % of the total biomass above the 130 mm MLS.</p>

<p>The size distribution of razor clams in the North Irish Sea in 2023 shows two main cohorts, one at ~160 mm, similar to the 2022 survey, and a significant recruitment event at ~110 mm not detected in the previous year survey. Densities of razors above the MLS of 130 mm remains similar to the 2022 survey.  A smaller cohort in the 2023 survey is also apparent at ~60 mm, although numbers are low, as these sizes are generally not selected by the gear.</p>

"
